<?xml version = "1.0" encoding = "UTF-8"?>
<!DOCTYPE toolbar SYSTEM "../toolbar.dtd" []>
<toolbar width = "16"
         height = "15">
    <item toolTip = "New"
          statusTip = "Create a new scene."
          eventHandler = "ToolBarFileNewEventHandler">
        0x42,0x4d,0x06,0x03,0x00,0x00,0x00,0x00,0x00,0x00,0x36,0x00,0x00,0x00,0x28,0x00,
        0x00,0x00,0x10,0x00,0x00,0x00,0x0f,0x00,0x00,0x00,0x01,0x00,0x18,0x00,0x00,0x00,
        0x00,0x00,0xd0,0x02,0x00,0x00,0x00,0x00,0x00,0x00,0x00,0x00,0x00,0x00,0x00,0x00,
        0x00,0x00,0x00,0x00,0x00,0x00,0xc0,0xc0,0xc0,0xc0,0xc0,0xc0,0xc0,0xc0,0xc0,0xc0,
        0xc0,0xc0,0xc0,0xc0,0xc0,0xc0,0xc0,0xc0,0xc0,0xc0,0xc0,0xc0,0xc0,0xc0,0xc0,0xc0,
        0xc0,0xc0,0xc0,0xc0,0xc0,0xc0,0xc0,0xc0,0xc0,0xc0,0xc0,0xc0,0xc0,0xc0,0xc0,0xc0,
        0xc0,0xc0,0xc0,0xc0,0xc0,0xc0,0xc0,0xc0,0xc0,0xc0,0xc0,0xc0,0xc0,0xc0,0xc0,0xc0,
        0xc0,0xc0,0xc0,0xc0,0xc0,0xc0,0xc0,0xc0,0xc0,0xc0,0xc0,0xc0,0xc0,0xc0,0xc0,0xc0,
        0xc0,0xc0,0xc0,0xc0,0xc0,0xc0,0xc0,0xc0,0xc0,0xc0,0xc0,0xc0,0xc0,0xc0,0xc0,0xc0,
        0xc0,0xc0,0xc0,0xc0,0xc0,0xc0,0xc0,0xc0,0xc0,0xc0,0xc0,0xc0,0xc0,0xc0,0xc0,0x00,
        0x00,0x00,0x00,0x00,0x00,0x00,0x00,0x00,0x00,0x00,0x00,0x00,0x00,0x00,0x00,0x00,
        0x00,0x00,0x00,0x00,0x00,0x00,0x00,0x00,0x00,0x00,0x00,0x00,0x00,0x00,0x00,0x00,
        0xc0,0xc0,0xc0,0xc0,0xc0,0xc0,0xc0,0xc0,0xc0,0xc0,0xc0,0xc0,0xc0,0xc0,0xc0,0x00,
        0x00,0x00,0xff,0xff,0xff,0xff,0xff,0xff,0xff,0xff,0xff,0xff,0xff,0xff,0xff,0xff,
        0xff,0xff,0xff,0xff,0xff,0xff,0xff,0xff,0xff,0xff,0xff,0xff,0xff,0x00,0x00,0x00,
        0xc0,0xc0,0xc0,0xc0,0xc0,0xc0,0xc0,0xc0,0xc0,0xc0,0xc0,0xc0,0xc0,0xc0,0xc0,0x00,
        0x00,0x00,0xff,0xff,0xff,0xff,0xff,0xff,0xff,0xff,0xff,0xff,0xff,0xff,0xff,0xff,
        0xff,0xff,0xff,0xff,0xff,0xff,0xff,0xff,0xff,0xff,0xff,0xff,0xff,0x00,0x00,0x00,
        0xc0,0xc0,0xc0,0xc0,0xc0,0xc0,0xc0,0xc0,0xc0,0xc0,0xc0,0xc0,0xc0,0xc0,0xc0,0x00,
        0x00,0x00,0xff,0xff,0xff,0xff,0xff,0xff,0xff,0xff,0xff,0xff,0xff,0xff,0xff,0xff,
        0xff,0xff,0xff,0xff,0xff,0xff,0xff,0xff,0xff,0xff,0xff,0xff,0xff,0x00,0x00,0x00,
        0xc0,0xc0,0xc0,0xc0,0xc0,0xc0,0xc0,0xc0,0xc0,0xc0,0xc0,0xc0,0xc0,0xc0,0xc0,0x00,
        0x00,0x00,0xff,0xff,0xff,0xff,0xff,0xff,0xff,0xff,0xff,0xff,0xff,0xff,0xff,0xff,
        0xff,0xff,0xff,0xff,0xff,0xff,0xff,0xff,0xff,0xff,0xff,0xff,0xff,0x00,0x00,0x00,
        0xc0,0xc0,0xc0,0xc0,0xc0,0xc0,0xc0,0xc0,0xc0,0xc0,0xc0,0xc0,0xc0,0xc0,0xc0,0x00,
        0x00,0x00,0xff,0xff,0xff,0xff,0xff,0xff,0xff,0xff,0xff,0xff,0xff,0xff,0xff,0xff,
        0xff,0xff,0xff,0xff,0xff,0xff,0xff,0xff,0xff,0xff,0xff,0xff,0xff,0x00,0x00,0x00,
        0xc0,0xc0,0xc0,0xc0,0xc0,0xc0,0xc0,0xc0,0xc0,0xc0,0xc0,0xc0,0xc0,0xc0,0xc0,0x00,
        0x00,0x00,0xff,0xff,0xff,0xff,0xff,0xff,0xff,0xff,0xff,0xff,0xff,0xff,0xff,0xff,
        0xff,0xff,0xff,0xff,0xff,0xff,0xff,0xff,0xff,0xff,0xff,0xff,0xff,0x00,0x00,0x00,
        0xc0,0xc0,0xc0,0xc0,0xc0,0xc0,0xc0,0xc0,0xc0,0xc0,0xc0,0xc0,0xc0,0xc0,0xc0,0x00,
        0x00,0x00,0xff,0xff,0xff,0xff,0xff,0xff,0xff,0xff,0xff,0xff,0xff,0xff,0xff,0xff,
        0xff,0xff,0xff,0xff,0xff,0xff,0xff,0xff,0xff,0xff,0xff,0xff,0xff,0x00,0x00,0x00,
        0xc0,0xc0,0xc0,0xc0,0xc0,0xc0,0xc0,0xc0,0xc0,0xc0,0xc0,0xc0,0xc0,0xc0,0xc0,0x00,
        0x00,0x00,0xff,0xff,0xff,0xff,0xff,0xff,0xff,0xff,0xff,0xff,0xff,0xff,0xff,0xff,
        0xff,0xff,0xff,0xff,0xff,0xff,0xff,0xff,0xff,0xff,0xff,0xff,0xff,0x00,0x00,0x00,
        0xc0,0xc0,0xc0,0xc0,0xc0,0xc0,0xc0,0xc0,0xc0,0xc0,0xc0,0xc0,0xc0,0xc0,0xc0,0x00,
        0x00,0x00,0xff,0xff,0xff,0xff,0xff,0xff,0xff,0xff,0xff,0xff,0xff,0xff,0xff,0xff,
        0xff,0xff,0xff,0xff,0x00,0x00,0x00,0x00,0x00,0x00,0x00,0x00,0x00,0x00,0x00,0x00,
        0xc0,0xc0,0xc0,0xc0,0xc0,0xc0,0xc0,0xc0,0xc0,0xc0,0xc0,0xc0,0xc0,0xc0,0xc0,0x00,
        0x00,0x00,0xff,0xff,0xff,0xff,0xff,0xff,0xff,0xff,0xff,0xff,0xff,0xff,0xff,0xff,
        0xff,0xff,0xff,0xff,0x00,0x00,0x00,0xff,0xff,0xff,0x00,0x00,0x00,0xc0,0xc0,0xc0,
        0xc0,0xc0,0xc0,0xc0,0xc0,0xc0,0xc0,0xc0,0xc0,0xc0,0xc0,0xc0,0xc0,0xc0,0xc0,0x00,
        0x00,0x00,0xff,0xff,0xff,0xff,0xff,0xff,0xff,0xff,0xff,0xff,0xff,0xff,0xff,0xff,
        0xff,0xff,0xff,0xff,0x00,0x00,0x00,0x00,0x00,0x00,0xc0,0xc0,0xc0,0xc0,0xc0,0xc0,
        0xc0,0xc0,0xc0,0xc0,0xc0,0xc0,0xc0,0xc0,0xc0,0xc0,0xc0,0xc0,0xc0,0xc0,0xc0,0x00,
        0x00,0x00,0x00,0x00,0x00,0x00,0x00,0x00,0x00,0x00,0x00,0x00,0x00,0x00,0x00,0x00,
        0x00,0x00,0x00,0x00,0x00,0x00,0x00,0xc0,0xc0,0xc0,0xc0,0xc0,0xc0,0xc0,0xc0,0xc0,
        0xc0,0xc0,0xc0,0xc0,0xc0,0xc0,
    </item>
    <item toolTip = "Open"
          statusTip = "Open an existing scene."
          eventHandler = "ToolBarFileOpenEventHandler">
        0x42,0x4d,0x06,0x03,0x00,0x00,0x00,0x00,0x00,0x00,0x36,0x00,0x00,0x00,0x28,0x00,
        0x00,0x00,0x10,0x00,0x00,0x00,0x0f,0x00,0x00,0x00,0x01,0x00,0x18,0x00,0x00,0x00,
        0x00,0x00,0xd0,0x02,0x00,0x00,0x00,0x00,0x00,0x00,0x00,0x00,0x00,0x00,0x00,0x00,
        0x00,0x00,0x00,0x00,0x00,0x00,0xc0,0xc0,0xc0,0xc0,0xc0,0xc0,0xc0,0xc0,0xc0,0xc0,
        0xc0,0xc0,0xc0,0xc0,0xc0,0xc0,0xc0,0xc0,0xc0,0xc0,0xc0,0xc0,0xc0,0xc0,0xc0,0xc0,
        0xc0,0xc0,0xc0,0xc0,0xc0,0xc0,0xc0,0xc0,0xc0,0xc0,0xc0,0xc0,0xc0,0xc0,0xc0,0xc0,
        0xc0,0xc0,0xc0,0xc0,0xc0,0xc0,0xc0,0xc0,0xc0,0xc0,0xc0,0xc0,0xc0,0xc0,0xc0,0xc0,
        0xc0,0xc0,0xc0,0xc0,0xc0,0xc0,0xc0,0xc0,0xc0,0xc0,0xc0,0xc0,0xc0,0xc0,0xc0,0xc0,
        0xc0,0xc0,0xc0,0xc0,0xc0,0xc0,0xc0,0xc0,0xc0,0xc0,0xc0,0xc0,0xc0,0xc0,0xc0,0xc0,
        0xc0,0xc0,0xc0,0xc0,0xc0,0xc0,0xc0,0xc0,0xc0,0x00,0x00,0x00,0x00,0x00,0x00,0x00,
        0x00,0x00,0x00,0x00,0x00,0x00,0x00,0x00,0x00,0x00,0x00,0x00,0x00,0x00,0x00,0x00,
        0x00,0x00,0x00,0x00,0x00,0x00,0x00,0x00,0x00,0x00,0xc0,0xc0,0xc0,0xc0,0xc0,0xc0,
        0xc0,0xc0,0xc0,0xc0,0xc0,0xc0,0xc0,0xc0,0xc0,0x00,0x00,0x00,0x00,0x00,0x00,0x00,
        0x80,0x80,0x00,0x80,0x80,0x00,0x80,0x80,0x00,0x80,0x80,0x00,0x80,0x80,0x00,0x80,
        0x80,0x00,0x80,0x80,0x00,0x80,0x80,0x00,0x80,0x80,0x00,0x00,0x00,0xc0,0xc0,0xc0,
        0xc0,0xc0,0xc0,0xc0,0xc0,0xc0,0xc0,0xc0,0xc0,0x00,0x00,0x00,0xff,0xff,0xff,0x00,
        0x00,0x00,0x00,0x80,0x80,0x00,0x80,0x80,0x00,0x80,0x80,0x00,0x80,0x80,0x00,0x80,
        0x80,0x00,0x80,0x80,0x00,0x80,0x80,0x00,0x80,0x80,0x00,0x80,0x80,0x00,0x00,0x00,
        0xc0,0xc0,0xc0,0xc0,0xc0,0xc0,0xc0,0xc0,0xc0,0x00,0x00,0x00,0x00,0xff,0xff,0xff,
        0xff,0xff,0x00,0x00,0x00,0x00,0x80,0x80,0x00,0x80,0x80,0x00,0x80,0x80,0x00,0x80,
        0x80,0x00,0x80,0x80,0x00,0x80,0x80,0x00,0x80,0x80,0x00,0x80,0x80,0x00,0x80,0x80,
        0x00,0x00,0x00,0xc0,0xc0,0xc0,0xc0,0xc0,0xc0,0x00,0x00,0x00,0xff,0xff,0xff,0x00,
        0xff,0xff,0xff,0xff,0xff,0x00,0x00,0x00,0x00,0x80,0x80,0x00,0x80,0x80,0x00,0x80,
        0x80,0x00,0x80,0x80,0x00,0x80,0x80,0x00,0x80,0x80,0x00,0x80,0x80,0x00,0x80,0x80,
        0x00,0x80,0x80,0x00,0x00,0x00,0xc0,0xc0,0xc0,0x00,0x00,0x00,0x00,0xff,0xff,0xff,
        0xff,0xff,0x00,0xff,0xff,0xff,0xff,0xff,0x00,0x00,0x00,0x00,0x00,0x00,0x00,0x00,
        0x00,0x00,0x00,0x00,0x00,0x00,0x00,0x00,0x00,0x00,0x00,0x00,0x00,0x00,0x00,0x00,
        0x00,0x00,0x00,0x00,0x00,0x00,0xc0,0xc0,0xc0,0x00,0x00,0x00,0xff,0xff,0xff,0x00,
        0xff,0xff,0xff,0xff,0xff,0x00,0xff,0xff,0xff,0xff,0xff,0x00,0xff,0xff,0xff,0xff,
        0xff,0x00,0xff,0xff,0xff,0xff,0xff,0x00,0x00,0x00,0xc0,0xc0,0xc0,0xc0,0xc0,0xc0,
        0xc0,0xc0,0xc0,0xc0,0xc0,0xc0,0xc0,0xc0,0xc0,0x00,0x00,0x00,0x00,0xff,0xff,0xff,
        0xff,0xff,0x00,0xff,0xff,0xff,0xff,0xff,0x00,0xff,0xff,0xff,0xff,0xff,0x00,0xff,
        0xff,0xff,0xff,0xff,0x00,0xff,0xff,0x00,0x00,0x00,0xc0,0xc0,0xc0,0xc0,0xc0,0xc0,
        0xc0,0xc0,0xc0,0xc0,0xc0,0xc0,0xc0,0xc0,0xc0,0x00,0x00,0x00,0xff,0xff,0xff,0x00,
        0xff,0xff,0xff,0xff,0xff,0x00,0x00,0x00,0x00,0x00,0x00,0x00,0x00,0x00,0x00,0x00,
        0x00,0x00,0x00,0x00,0x00,0x00,0x00,0x00,0x00,0x00,0xc0,0xc0,0xc0,0xc0,0xc0,0xc0,
        0xc0,0xc0,0xc0,0xc0,0xc0,0xc0,0xc0,0xc0,0xc0,0xc0,0xc0,0xc0,0x00,0x00,0x00,0x00,
        0x00,0x00,0x00,0x00,0x00,0xc0,0xc0,0xc0,0xc0,0xc0,0xc0,0xc0,0xc0,0xc0,0xc0,0xc0,
        0xc0,0xc0,0xc0,0xc0,0xc0,0xc0,0xc0,0xc0,0xc0,0xc0,0xc0,0xc0,0xc0,0x00,0x00,0x00,
        0x00,0x00,0x00,0x00,0x00,0x00,0xc0,0xc0,0xc0,0xc0,0xc0,0xc0,0xc0,0xc0,0xc0,0xc0,
        0xc0,0xc0,0xc0,0xc0,0xc0,0xc0,0xc0,0xc0,0xc0,0xc0,0xc0,0xc0,0xc0,0xc0,0xc0,0xc0,
        0xc0,0xc0,0xc0,0xc0,0xc0,0xc0,0xc0,0xc0,0xc0,0xc0,0xc0,0xc0,0xc0,0xc0,0xc0,0xc0,
        0x00,0x00,0x00,0x00,0x00,0x00,0xc0,0xc0,0xc0,0xc0,0xc0,0xc0,0xc0,0xc0,0xc0,0xc0,
        0xc0,0xc0,0xc0,0xc0,0xc0,0xc0,0xc0,0xc0,0xc0,0xc0,0xc0,0xc0,0xc0,0xc0,0xc0,0xc0,
        0xc0,0x00,0x00,0x00,0xc0,0xc0,0xc0,0xc0,0xc0,0xc0,0xc0,0xc0,0xc0,0x00,0x00,0x00,
        0xc0,0xc0,0xc0,0x00,0x00,0x00,0xc0,0xc0,0xc0,0xc0,0xc0,0xc0,0xc0,0xc0,0xc0,0xc0,
        0xc0,0xc0,0xc0,0xc0,0xc0,0xc0,0xc0,0xc0,0xc0,0xc0,0xc0,0xc0,0xc0,0xc0,0xc0,0xc0,
        0xc0,0xc0,0xc0,0xc0,0x00,0x00,0x00,0x00,0x00,0x00,0x00,0x00,0x00,0xc0,0xc0,0xc0,
        0xc0,0xc0,0xc0,0xc0,0xc0,0xc0
    </item>
    <item toolTip = "Save"
          statusTip = "Save current scene."
          eventHandler = "ToolBarFileSaveEventHandler">
        0x42,0x4d,0x06,0x03,0x00,0x00,0x00,0x00,0x00,0x00,0x36,0x00,0x00,0x00,0x28,0x00,
        0x00,0x00,0x10,0x00,0x00,0x00,0x0f,0x00,0x00,0x00,0x01,0x00,0x18,0x00,0x00,0x00,
        0x00,0x00,0xd0,0x02,0x00,0x00,0x00,0x00,0x00,0x00,0x00,0x00,0x00,0x00,0x00,0x00,
        0x00,0x00,0x00,0x00,0x00,0x00,0xc0,0xc0,0xc0,0xc0,0xc0,0xc0,0xc0,0xc0,0xc0,0xc0,
        0xc0,0xc0,0xc0,0xc0,0xc0,0xc0,0xc0,0xc0,0xc0,0xc0,0xc0,0xc0,0xc0,0xc0,0xc0,0xc0,
        0xc0,0xc0,0xc0,0xc0,0xc0,0xc0,0xc0,0xc0,0xc0,0xc0,0xc0,0xc0,0xc0,0xc0,0xc0,0xc0,
        0xc0,0xc0,0xc0,0xc0,0xc0,0xc0,0xc0,0xc0,0xc0,0xc0,0xc0,0xc0,0x00,0x00,0x00,0x00,
        0x00,0x00,0x00,0x00,0x00,0x00,0x00,0x00,0x00,0x00,0x00,0x00,0x00,0x00,0x00,0x00,